[
  {
    "name": "Git for Windows",
    "winget": "Git.Git",
    "choco": "git",
    "category": "Development",
    "description": "Version control system"
  },
  {
    "name": "Visual Studio Code",
    "winget": "Microsoft.VisualStudioCode",
    "choco": "vscode",
    "category": "Development",
    "description": "Code editor by Microsoft"
  },
  {
    "name": "PowerShell 7",
    "winget": "Microsoft.Powershell",
    "choco": "powershell",
    "category": "System",
    "description": "Modern PowerShell cross-platform"
  },
  {
    "name": "Windows Terminal",
    "winget": "Microsoft.WindowsTerminal",
    "choco": "microsoft-windows-terminal",
    "category": "System",
    "description": "Modern terminal application"
  },
  {
    "name": "Java Runtime Environment",
    "winget": "Oracle.JavaRuntimeEnvironment",
    "choco": "javaruntime", 
    "category": "Runtime",
    "description": "Java runtime environment"
  },
  {
    "name": "Python 3",
    "winget": "Python.Python.3",
    "choco": "python",
    "category": "Development",
    "description": "Python programming language"
  },
  {
    "name": "Node.js",
    "winget": "OpenJS.NodeJS",
    "choco": "nodejs",
    "category": "Development",
    "description": "JavaScript runtime environment"
  }
]